[
  {
    "name": "mgmt-global",
    "routing_mode": "GLOBAL",
    "description": "",
    "subnetworks": {
      "us-central1": {
        "0": {
          "description": "",
          "purpose": "PRIVATE",
          "ip_cidr_range": "10.255.0.0/24",
          "private_google_access": true,
          "log_config": {
            "aggregation_interval": "INTERVAL_30_SEC",
            "flow_sampling": 1,
            "metadata": "INCLUDE_ALL_METADATA",
            "metadata_fields": []
          },
          "secondary_ranges": []
        }
      },
      "us-east4": {
        "0": {
          "description": "",
          "purpose": "PRIVATE",
          "ip_cidr_range": "10.255.32.0/24",
          "private_google_access": true,
          "log_config": {
            "aggregation_interval": "INTERVAL_30_SEC",
            "flow_sampling": 1,
            "metadata": "INCLUDE_ALL_METADATA",
            "metadata_fields": []
          },
          "secondary_ranges": []
        }
      }
    },
    "firewall_rules": [
      {
        "id": "allow-ssh-rteller",
        "description": "",
        "action": "allow",
        "priority": 1000,
        "direction": "INGRESS",
        "sources": [
          "98.247.221.22/32"
        ],
        "targets": [
          "ngfw"
        ],
        "rules": [
          {
            "protocol": "TCP",
            "ports": [
              22,
              443
            ]
          }
        ]
      }
    ],
    "routes":[
      {
        "name": "mgmt-global-default",
        "dest_range": "0.0.0.0/0",
        "priority": 0,
        "next_hop_gateway": "default-internet-gateway"
      }
    ]
  }
]
