[
  {
    "name": "dmz-global",
    "routing_mode": "GLOBAL",
    "description": "",
    "subnetworks": {
      "us-central1": {
        "0": {
          "description": "",
          "purpose": "PRIVATE",
          "ip_cidr_range": "192.168.0.0/24",
          "private_google_access": true,
          "log_config": {
            "aggregation_interval": "INTERVAL_30_SEC",
            "flow_sampling": 1,
            "metadata": "INCLUDE_ALL_METADATA",
            "metadata_fields": []
          },
          "secondary_ranges": [ ]
        },
        "1": {
          "description": "",
          "purpose": "PRIVATE",
          "ip_cidr_range": "192.168.2.0/24",
          "private_google_access": true,
          "log_config": {
            "aggregation_interval": "INTERVAL_30_SEC",
            "flow_sampling": 1,
            "metadata": "INCLUDE_ALL_METADATA",
            "metadata_fields": []
          },
          "secondary_ranges": [ ]
        }
      },  
      "us-east4": {
        "0": {
          "description": "",
          "purpose": "PRIVATE",
          "ip_cidr_range": "192.168.32.0/24",
          "private_google_access": true,
          "log_config": {
            "aggregation_interval": "INTERVAL_30_SEC",
            "flow_sampling": 1,
            "metadata": "INCLUDE_ALL_METADATA",
            "metadata_fields": []
          },
          "secondary_ranges": [ ]
        },
        "1": {
          "description": "",
          "purpose": "PRIVATE",
          "ip_cidr_range": "192.168.34.0/24",
          "private_google_access": true,
          "log_config": {
            "aggregation_interval": "INTERVAL_30_SEC",
            "flow_sampling": 1,
            "metadata": "INCLUDE_ALL_METADATA",
            "metadata_fields": []
          },
          "secondary_ranges": [ ]
        }
      }
    },
    "firewall_rules":[],
    "routes":[]
  }
]
