[
  {
    "name": "cloud-nat-selected",
    "routing_mode": "GLOBAL",
    "cloud_nat": {
      "subnetworks_to_nat": "SELECTED_PRIMARY_SUBNETWORKS_SELECTED_SECONDARY_SUBNETWORKS",
      "nat_groups": [
          {
              "nat_group_id": "asdfasdf"
          },
          {
              "nat_group_id": "aaaa"
          }
      ]
    },
    "subnetworks": [
      {
        "region": "us-west1",
        "ip_cidr_range": "172.16.32.0/24",
        "cloud_nat": {
            "nat_group_id": "aaaa",
            "subnetworks_to_nat": "ALL_SUBNETWORKS"
        },
        "secondary_subnetworks": [
          {
            "ip_cidr_range": "10.32.31.0/24"
          },
          {
            "ip_cidr_range": "10.32.32.0/24"
          }
        ]
      },
      {
        "region": "us-west1",
        "ip_cidr_range": "172.16.33.0/24",
        "cloud_nat": {
            "nat_group_id": "aaaa",
            "subnetworks_to_nat": "PRIMARY_SUBNETWORK"
        },
        "secondary_subnetworks": [
          {
            "ip_cidr_range": "10.33.31.0/24"
          },
          {
            "ip_cidr_range": "10.33.32.0/24"
          }
        ]
      },
      {
        "region": "us-west1",
        "ip_cidr_range": "172.16.34.0/24",
        "cloud_nat": {
            "nat_group_id": "aaaa",
            "subnetworks_to_nat": "PRIMARY_SUBNETWORK_SELECTED_SECONDARY_SUBNETWORKS"
        },
        "secondary_subnetworks": [
          {
            "ip_cidr_range": "10.34.31.0/24"
          },
          {
            "ip_cidr_range": "10.34.32.0/24"
          }
        ]
      },
      {
        "region": "us-west1",
        "ip_cidr_range": "172.16.35.0/24",
        "cloud_nat": {
            "nat_group_id": "aaaa",
            "subnetworks_to_nat": "PRIMARY_SUBNETWORK_SELECTED_SECONDARY_SUBNETWORKS"
        },
        "secondary_subnetworks": [
          {
            "nat_group_id": "aaaa",
            "ip_cidr_range": "10.35.31.0/24"
          },
          {
            "nat_group_id": "aaab",
            "ip_cidr_range": "10.35.32.0/24"
          }
        ]
      },
      {
        "notes_about_test": "this should not create cloud router or configure cloud_nat for this primary subnet ",
        "region": "us-east4",
        "ip_cidr_range": "172.16.64.0/24",
        "cloud_nat": {
            "nat_group_id": "asdfasdf",
            "subnetworks_to_nat": "SELECTED_SECONDARY_SUBNETWORKS"
        }
      },
      {
        "notes_about_test": "this should create cloud router and configure cloud_nat for this primary subnet but not secondary ranges",
        "region": "us-east4",
        "ip_cidr_range": "172.16.65.0/24",
        "cloud_nat": {
            "nat_group_id": "asdfasdf",
            "subnetworks_to_nat": "primary_SUBNETWORKS"
        }
      },
      {
        "region": "us-west1",
        "ip_cidr_range": "172.16.36.0/24",
        "cloud_nat": {
            "nat_group_id": "aaaa",
            "subnetworks_to_nat": "SELECTED_SECONDARY_SUBNETWORKS"
        },
        "secondary_subnetworks": [
          {
            "nat_group_id": "aaaa",
            "ip_cidr_range": "10.36.31.0/24"
          },
          {
            "nat_group_id": "asdfasdf",
            "ip_cidr_range": "10.36.32.0/24"
          },
          {
            "nat_group_id": "aaaa",
            "ip_cidr_range": "10.36.33.0/24"
          }
        ]
      }
    ]
  }
]
